{
  "schemaVersion": 1,
  "repository": "https://github.com/Wulfgardr/mediflow",
  "sourceCommit": "90fa7771fc0822475611c9affb9c22e212939399",
  "scope": "Due esempi del codice: lettura headless delle attività e conferma Web di una transizione checkup.",
  "limits": [
    "Mappa curata di relazioni nel sorgente, non tracciamento del runtime.",
    "Un import attesta una dipendenza nel codice, non esecuzione, raggiungibilità o autorizzazione.",
    "Nessun dato clinico, collegamento a MediFlow o modello AI in questa pagina.",
    "Non copre Fabric, tutti i percorsi UI, tutti i writer o una valutazione delle protezioni."
  ],
  "nodes": [
    {
      "id": "mcp",
      "label": "Ingresso agenti · MCP",
      "group": "surface",
      "x": 95,
      "y": 70,
      "summary": "Espone operazioni nominate a un client agente, attraverso un canale mediato.",
      "questions": {
        "data": "Le richieste passano al client RPC; questo ingresso non espone un database al client.",
        "authority": "Il catalogo distingue letture e proposte. Il tool checkup prepara una transizione da confermare nel Web.",
        "evidence": "Le fonti qui sotto attestano il codice presente alla revisione mostrata. Non sono una prova di esecuzione sul tuo Mac."
      },
      "knownUnknown": "Compatibilità e collegamento con un host esterno non sono dimostrati dalla mappa.",
      "evidence": [
        {
          "path": "packages/mcp/src/server.ts",
          "anchor": "export async function createUsefulMcpServer()",
          "line": 25,
          "endLine": 25,
          "blob": "61aece520d34f48a2b0932b716e08cdd1e6ddd7c",
          "sha256": "f025712ca33e502f4462540fc1d71824fc5484e3594e51d61dc5bcde860a8c31",
          "url": "https://github.com/Wulfgardr/mediflow/blob/90fa7771fc0822475611c9affb9c22e212939399/packages/mcp/src/server.ts#L25-L25"
        }
      ]
    },
    {
      "id": "mini",
      "label": "Terminale · Mini",
      "group": "surface",
      "x": 95,
      "y": 200,
      "summary": "Traduce comandi circoscritti del terminale negli stessi metodi del client RPC.",
      "questions": {
        "data": "I comandi raggiungono il client RPC, fra cui ricerca terminologica e lettura delle attività.",
        "authority": "Il protocollo elenca i comandi ammessi. Un comando non concede accesso diretto a SQLite.",
        "evidence": "Le fonti qui sotto attestano il codice presente alla revisione mostrata. Non sono una prova di esecuzione sul tuo Mac."
      },
      "knownUnknown": "Mini è un percorso di sviluppo; la presenza del protocollo non qualifica una distribuzione.",
      "evidence": [
        {
          "path": "packages/mini/src/protocol.ts",
          "anchor": "export function executeMiniRequest(",
          "line": 37,
          "endLine": 37,
          "blob": "976046842f8162ad8aa3ea03f287315105ff15fe",
          "sha256": "de2816cc62b4dcfb306c9aad7ffbad33a33cacfba06e69dfab80b16a34ac4e5b",
          "url": "https://github.com/Wulfgardr/mediflow/blob/90fa7771fc0822475611c9affb9c22e212939399/packages/mini/src/protocol.ts#L37-L37"
        }
      ]
    },
    {
      "id": "client",
      "label": "Canale verso l’host",
      "group": "transport",
      "x": 290,
      "y": 125,
      "summary": "Invia richieste sul collegamento ereditato dal processo padre e ne controlla le risposte.",
      "questions": {
        "data": "Il codice usa messaggi IPC, con limiti di dimensione e scadenza delle richieste.",
        "authority": "In assenza del collegamento previsto il client rifiuta la richiesta con host_unbound.",
        "evidence": "Le fonti qui sotto attestano il codice presente alla revisione mostrata. Non sono una prova di esecuzione sul tuo Mac."
      },
      "knownUnknown": "Non è una cattura di messaggi reali né una prova della configurazione corrente.",
      "evidence": [
        {
          "path": "packages/mcp/src/operation-client.ts",
          "anchor": "export function createOperationClient()",
          "line": 38,
          "endLine": 38,
          "blob": "992a2f59fc288fe9e1fb763a2421431c89c74080",
          "sha256": "c7504ec6c30905c93e88e9a5fbb3fdbedab04dfa820779d1cd8c9364bba2e7d6",
          "url": "https://github.com/Wulfgardr/mediflow/blob/90fa7771fc0822475611c9affb9c22e212939399/packages/mcp/src/operation-client.ts#L38-L38"
        }
      ]
    },
    {
      "id": "composition",
      "label": "Composizione dell’host",
      "group": "host",
      "x": 290,
      "y": 285,
      "summary": "Coordina i processi e compone i servizi dell’host che li collega.",
      "questions": {
        "data": "Il Supervisor collega Web e processo agente su IPC ereditato.",
        "authority": "La composizione fornisce contesto e servizi al launcher; la chiusura revoca il collegamento.",
        "evidence": "Le fonti qui sotto attestano il codice presente alla revisione mostrata. Non sono una prova di esecuzione sul tuo Mac."
      },
      "knownUnknown": "La mappa non prova avvio, installazione o disponibilità dei servizi.",
      "evidence": [
        {
          "path": "lib/security/portable-supervisor-production.ts",
          "anchor": "export function createPortableSupervisorProductionRuntimeV1(",
          "line": 70,
          "endLine": 70,
          "blob": "74c51e3424f15517257e4ad0d7bff4f25ec2cbf7",
          "sha256": "f3752cebc4a18416ef2bad3e5ee5b7f95ca16ede760d0524be41756b9067547c",
          "url": "https://github.com/Wulfgardr/mediflow/blob/90fa7771fc0822475611c9affb9c22e212939399/lib/security/portable-supervisor-production.ts#L70-L70"
        },
        {
          "path": "lib/security/authenticated-headless-agent-launcher-production.ts",
          "anchor": "function createProductionLauncher(",
          "line": 75,
          "endLine": 75,
          "blob": "983449748589715459db56070f36d9aa7187907e",
          "sha256": "ad02f36bf3ff919facf0e8ff3c05bc409d29662788ca9f9f46aaa3625c82c865",
          "url": "https://github.com/Wulfgardr/mediflow/blob/90fa7771fc0822475611c9affb9c22e212939399/lib/security/authenticated-headless-agent-launcher-production.ts#L75-L75"
        }
      ]
    },
    {
      "id": "launcher",
      "label": "Sessione e operazioni",
      "group": "policy",
      "x": 485,
      "y": 125,
      "summary": "Associa sessione, ambito e operazioni ai servizi nominati dell’host.",
      "questions": {
        "data": "Il catalogo RPC collega la lettura delle attività al servizio Open Loops.",
        "authority": "Prima della lettura viene richiesto un permesso al broker. Il checkup headless resta proposal_only.",
        "evidence": "Le fonti qui sotto attestano il codice presente alla revisione mostrata. Non sono una prova di esecuzione sul tuo Mac."
      },
      "knownUnknown": "Le operazioni rappresentate sono un campione, non il catalogo completo.",
      "evidence": [
        {
          "path": "lib/headless/authenticated-agent-launcher.ts",
          "anchor": "export function createAuthenticatedAgentLauncherV1(",
          "line": 52,
          "endLine": 52,
          "blob": "6a54ac94d9a2443c065304879f20564198a153c7",
          "sha256": "27c294fbb8ddfe2dbeccb62b606b0ed1a0adf83739947ce6650448bb2c42134d",
          "url": "https://github.com/Wulfgardr/mediflow/blob/90fa7771fc0822475611c9affb9c22e212939399/lib/headless/authenticated-agent-launcher.ts#L52-L52"
        }
      ]
    },
    {
      "id": "broker",
      "label": "Regole e permessi · AIP",
      "group": "policy",
      "x": 680,
      "y": 60,
      "summary": "Controlla ambito, durata, revoca e budget dei permessi dell’agente.",
      "questions": {
        "data": "Il broker lega i permessi a riferimenti e ambito della sessione.",
        "authority": "Può rifiutare permessi scaduti, revocati, riusati o incoerenti. Un collegamento nella mappa non concede un permesso.",
        "evidence": "Le fonti qui sotto attestano il codice presente alla revisione mostrata. Non sono una prova di esecuzione sul tuo Mac."
      },
      "knownUnknown": "Questa vista del sorgente non è una verifica indipendente delle protezioni.",
      "evidence": [
        {
          "path": "packages/aip/src/owner-broker.ts",
          "anchor": "export type AipOwnerBrokerV1ErrorCode",
          "line": 18,
          "endLine": 18,
          "blob": "a8957021eadb089c6c3b6ad6dd229df4d91d8354",
          "sha256": "1175c76d54f5fb8e91e0c4ba37f942a61a93b8334bfc5163ec55a7b7ad0215d3",
          "url": "https://github.com/Wulfgardr/mediflow/blob/90fa7771fc0822475611c9affb9c22e212939399/packages/aip/src/owner-broker.ts#L18-L18"
        }
      ]
    },
    {
      "id": "rpc",
      "label": "Operazioni RPC nominate",
      "group": "transport",
      "x": 680,
      "y": 205,
      "summary": "Riceve richieste per operazioni del catalogo, con uno stadio massimo dichiarato.",
      "questions": {
        "data": "Ogni definizione contiene un servizio nominato e una funzione execute.",
        "authority": "Il tipo distingue read_only e proposal_only; il trasporto non attribuisce autorità clinica generale.",
        "evidence": "Le fonti qui sotto attestano il codice presente alla revisione mostrata. Non sono una prova di esecuzione sul tuo Mac."
      },
      "knownUnknown": "Una definizione nel catalogo non dimostra esecuzione o ammissione in produzione.",
      "evidence": [
        {
          "path": "packages/aip/src/operation-rpc.ts",
          "anchor": "type Metadata = Readonly<",
          "line": 32,
          "endLine": 32,
          "blob": "9a53cdacf36c1208f1913fa51aeb7214c92ff1f0",
          "sha256": "2dcfc7a53075f4055da2e97f3a66197818ca95214b7833ab76ba87f172df2e72",
          "url": "https://github.com/Wulfgardr/mediflow/blob/90fa7771fc0822475611c9affb9c22e212939399/packages/aip/src/operation-rpc.ts#L32-L32"
        }
      ]
    },
    {
      "id": "openloops",
      "label": "Regole della lettura",
      "group": "service",
      "x": 680,
      "y": 340,